{
  "candidate_id": "delta",
  "captured_at": "2026-02-11T09:30:00Z",
  "characters": 735,
  "content_path": "outputs/response-paper-claim-delta.md",
  "id": "response-paper-claim-delta",
  "latency_seconds": 75.0,
  "notes": "Fictional output captured for the public demonstration.",
  "sha256": "sha256:0ca07d49c5295cbae44345126c9da3e84a26e0acf506a6e51884845e38302bbe",
  "state": "captured",
  "task_id": "paper-claim",
  "words": 99
}
